{
  "taskId": "stage4-3dgs-critique-20261009-v7",
  "requestId": "stage4-3dgs-critique-20261009-v7-request",
  "kind": "conversation.execute",
  "status": "failed",
  "error": "处理未完成，原问题和材料已保留，可重试。",
  "createdAt": "2026-10-09T12:33:12.731310+00:00",
  "updatedAt": "2026-10-09T12:35:27.760355+00:00",
  "request": {
    "expectedTaskRevision": 0,
    "message": "重点批判LightGaussian的15倍压缩与200+FPS主张：证据适用于哪些场景、比较条件和质量代价？剪枝、球谐降阶和向量量化分别有什么局限？",
    "capability": "critique",
    "allowedPaperIds": [
      "803219bf205d0142621b1ac5339f8d918d3f883f814559f6336b8bfdec5ca634.pdf"
    ],
    "primaryPaperId": "803219bf205d0142621b1ac5339f8d918d3f883f814559f6336b8bfdec5ca634.pdf",
    "strictScope": true,
    "steps": [],
    "allowExternalSearch": false
  },
  "paperIds": [
    "803219bf205d0142621b1ac5339f8d918d3f883f814559f6336b8bfdec5ca634.pdf"
  ]
}