{
  "taskId": "stage4-3dgs-compose-20261009-v6",
  "requestId": "stage4-3dgs-compose-20261009-v6-request",
  "kind": "conversation.execute",
  "status": "failed",
  "error": "处理未完成，原问题和材料已保留，可重试。",
  "createdAt": "2026-10-09T10:26:52.170552+00:00",
  "updatedAt": "2026-10-09T10:32:11.072350+00:00",
  "request": {
    "expectedTaskRevision": 0,
    "message": "先用两句话解释3DGS的高斯、透明度与球谐颜色，再比较原始3DGS与LightGaussian如何在表示规模、质量和渲染速度之间取舍。",
    "capability": "compose",
    "allowedPaperIds": [
      "f4c0c9f27e2d02b0265017f66049d471eb66cb50203bc918f51ba07d20cbbe11.pdf",
      "803219bf205d0142621b1ac5339f8d918d3f883f814559f6336b8bfdec5ca634.pdf"
    ],
    "primaryPaperId": "f4c0c9f27e2d02b0265017f66049d471eb66cb50203bc918f51ba07d20cbbe11.pdf",
    "strictScope": false,
    "steps": [
      "chat",
      "compare"
    ],
    "allowExternalSearch": false
  },
  "paperIds": [
    "f4c0c9f27e2d02b0265017f66049d471eb66cb50203bc918f51ba07d20cbbe11.pdf",
    "803219bf205d0142621b1ac5339f8d918d3f883f814559f6336b8bfdec5ca634.pdf"
  ]
}